{
  "schema_version": 3,
  "author_agent_id": "Codex_qa_20260823",
  "id": "validation-filtre-etats-1",
  "feature_id": "filtre-features-etat",
  "type": "validation_livraison",
  "sequence": 1,
  "created_at": "2026-08-23T13:00:00.000Z",
  "depends_on_document_ids": ["cr-filtre-etats-2", "audit-filtre-etats-1"],
  "cr_dev_id": "cr-filtre-etats-2",
  "audit_id": "audit-filtre-etats-1",
  "criteres_verifies": [
    { "id": "C-CODE", "statut": "pass", "preuve": "composant de menu utilisé" },
    { "id": "C-FONC", "statut": "pass", "preuve": "filtrage et restauration testés" },
    { "id": "C-UX", "statut": "pass", "preuve": "rendu avec filtre actif" },
    { "id": "C-SEC", "statut": "pass", "preuve": "saisie non interprétée" }
  ],
  "corrections_controlees": [
    { "id": "F-CODE-1", "statut": "pass", "preuve": "liste parallèle supprimée" }
  ],
  "gates_techniques": [
    { "id": "tests", "statut": "pass", "preuve": "npm run test:unit" }
  ],
  "preuves_fonctionnelles": ["Échap restaure la liste complète après filtrage"],
  "preuves_ux": ["Le filtre actif et le résumé filtré restent visibles"],
  "verdict": "pass"
}
